{
  "schema": "automatos-skin/v1",
  "slug": "daylight",
  "name": "Daylight",
  "version": "1.0.0",
  "author": "Automatos",
  "description": "Ember's paper tone on its own, light only. Molten stays a fill; wherever it is text it is darkened, so every word reads at AA.",
  "licence": "Apache-2.0",
  "base": "studio",
  "tones": [
    "light"
  ],
  "tokens": {
    "light": {
      "background": "30 35.3% 93.3%",
      "foreground": "22.5 14.8% 10.6%",
      "card": "0 0% 100%",
      "card-foreground": "22.5 14.8% 10.6%",
      "popover": "0 0% 100%",
      "popover-foreground": "22.5 14.8% 10.6%",
      "primary": "20.1 100% 56.1%",
      "primary-foreground": "20 85.7% 5.5%",
      "secondary": "30 28.6% 89%",
      "secondary-foreground": "22.5 14.8% 10.6%",
      "muted": "30 28.6% 89%",
      "muted-foreground": "28 7.5% 39%",
      "accent": "20.3 71.7% 38.8%",
      "accent-foreground": "0 0% 100%",
      "destructive": "1.3 38.7% 46.7%",
      "destructive-foreground": "0 0% 100%",
      "border": "28 18.1% 83.7%",
      "input": "28 18.1% 83.7%",
      "ring": "20.3 71.7% 38.8%",
      "success": "156.7 40.6% 32.4%",
      "success-foreground": "0 0% 100%",
      "warning": "42.1 86.3% 62.7%",
      "warning-foreground": "44 100% 5.9%",
      "info": "234.1 24.9% 48%",
      "info-foreground": "0 0% 100%",
      "agent": "343.6 43.8% 47.5%",
      "agent-foreground": "0 0% 100%",
      "chart-1": "20.1 100% 56.1%",
      "chart-2": "156.7 40.6% 32.4%",
      "chart-3": "234.1 24.9% 48%",
      "chart-4": "42.1 86.3% 62.7%",
      "chart-5": "343.6 43.8% 47.5%",
      "stage-1": "156.7 40.6% 32.4%",
      "stage-2": "234.1 24.9% 48%",
      "stage-3": "42.1 86.3% 62.7%",
      "stage-4": "28 7.5% 39%",
      "stage-5": "156.7 40.6% 32.4%",
      "stage-6": "20.1 100% 56.1%",
      "stage-7": "234.1 24.9% 48%",
      "stage-8": "343.6 43.8% 47.5%",
      "stage-9": "156.7 40.6% 32.4%",
      "olive": "87.5 39.9% 30%",
      "warn-ink": "40.5 45% 33.5%",
      "on-strong": "0 0% 100%",
      "border-2": "28.4 14.7% 74.7%",
      "accent-2": "20.1 100% 56.1%",
      "navy": "232.2 31.8% 33.3%"
    }
  },
  "fonts": {
    "sans": "Geist",
    "serif": "Newsreader",
    "mono": "Geist Mono"
  },
  "shape": {
    "radius": 14,
    "glow": 10
  },
  "mascot": {
    "mode": "off"
  },
  "preview": "assets/preview.png"
}
