{
  "schema": "automatos-skin/v1",
  "slug": "workshop",
  "name": "Workshop",
  "version": "1.0.0",
  "author": "Automatos",
  "description": "The original Automatos Play look: indigo night, molten buttons and Auto in bronze.",
  "licence": "Apache-2.0",
  "base": "classic",
  "tones": [
    "dark"
  ],
  "tokens": {
    "dark": {
      "background": "246.7 47.4% 11.2%",
      "foreground": "252 100% 97.1%",
      "card": "245.9 47.1% 17.1%",
      "card-foreground": "252 100% 97.1%",
      "popover": "245.9 47.1% 17.1%",
      "popover-foreground": "252 100% 97.1%",
      "primary": "20.1 100% 56.1%",
      "primary-foreground": "20 85.7% 5.5%",
      "secondary": "245.9 45.1% 22.2%",
      "secondary-foreground": "252 100% 97.1%",
      "muted": "245.9 45.1% 22.2%",
      "muted-foreground": "249.2 34.5% 77.8%",
      "accent": "20.1 100% 56.1%",
      "accent-foreground": "20 85.7% 5.5%",
      "destructive": "0 100% 71%",
      "destructive-foreground": "0 78.7% 9.2%",
      "border": "245.5 40.1% 26.9%",
      "input": "245.5 40.1% 26.9%",
      "ring": "20.1 100% 56.1%",
      "success": "159.3 84.6% 61.8%",
      "success-foreground": "157.5 66.7% 4.7%",
      "warning": "42.1 86.3% 62.7%",
      "warning-foreground": "44 100% 5.9%",
      "info": "232.2 100% 77.5%",
      "info-foreground": "234.4 61.5% 10.2%",
      "agent": "343.1 100% 68%",
      "agent-foreground": "338.9 78.7% 9.2%",
      "chart-1": "20.1 100% 56.1%",
      "chart-2": "159.3 84.6% 61.8%",
      "chart-3": "232.2 100% 77.5%",
      "chart-4": "42.1 86.3% 62.7%",
      "chart-5": "343.1 100% 68%",
      "stage-1": "159.3 84.6% 61.8%",
      "stage-2": "232.2 100% 77.5%",
      "stage-3": "42.1 86.3% 62.7%",
      "stage-4": "249.2 34.5% 77.8%",
      "stage-5": "159.3 84.6% 61.8%",
      "stage-6": "20.1 100% 56.1%",
      "stage-7": "232.2 100% 77.5%",
      "stage-8": "343.1 100% 68%",
      "stage-9": "159.3 84.6% 61.8%"
    }
  },
  "fonts": {
    "sans": "geist",
    "mono": "geist-mono"
  },
  "shape": {
    "radius": 14,
    "glow": 14
  },
  "mascot": {
    "mode": "auto",
    "shell": "bronze",
    "light": "mint"
  },
  "preview": "assets/preview.png"
}
