{
  "schema": "automatos-skin/v1",
  "slug": "ember",
  "name": "Ember",
  "version": "1.0.0",
  "author": "Automatos",
  "description": "Warm graphite and molten orange, with a paper day tone. The kit's own look, made a Studio skin.",
  "licence": "Apache-2.0",
  "base": "studio",
  "tones": [
    "light",
    "dark"
  ],
  "tokens": {
    "light": {
      "background": "30 35.3% 93.3%",
      "foreground": "22.5 14.8% 10.6%",
      "card": "0 0% 100%",
      "card-foreground": "22.5 14.8% 10.6%",
      "popover": "0 0% 100%",
      "popover-foreground": "22.5 14.8% 10.6%",
      "primary": "20.1 100% 56.1%",
      "primary-foreground": "20 85.7% 5.5%",
      "secondary": "30 28.6% 89%",
      "secondary-foreground": "22.5 14.8% 10.6%",
      "muted": "30 28.6% 89%",
      "muted-foreground": "28 7.5% 39%",
      "accent": "20.3 71.7% 38.8%",
      "accent-foreground": "0 0% 100%",
      "destructive": "1.3 38.7% 46.7%",
      "destructive-foreground": "0 0% 100%",
      "border": "28 18.1% 83.7%",
      "input": "28 18.1% 83.7%",
      "ring": "20.3 71.7% 38.8%",
      "success": "156.7 40.6% 32.4%",
      "success-foreground": "0 0% 100%",
      "warning": "42.1 86.3% 62.7%",
      "warning-foreground": "44 100% 5.9%",
      "info": "234.1 24.9% 48%",
      "info-foreground": "0 0% 100%",
      "agent": "343.6 43.8% 47.5%",
      "agent-foreground": "0 0% 100%",
      "chart-1": "20.1 100% 56.1%",
      "chart-2": "156.7 40.6% 32.4%",
      "chart-3": "234.1 24.9% 48%",
      "chart-4": "42.1 86.3% 62.7%",
      "chart-5": "343.6 43.8% 47.5%",
      "stage-1": "156.7 40.6% 32.4%",
      "stage-2": "234.1 24.9% 48%",
      "stage-3": "42.1 86.3% 62.7%",
      "stage-4": "28 7.5% 39%",
      "stage-5": "156.7 40.6% 32.4%",
      "stage-6": "20.1 100% 56.1%",
      "stage-7": "234.1 24.9% 48%",
      "stage-8": "343.6 43.8% 47.5%",
      "stage-9": "156.7 40.6% 32.4%",
      "olive": "87.5 39.9% 30%",
      "warn-ink": "40.5 45% 33.5%",
      "on-strong": "0 0% 100%",
      "border-2": "28.4 14.7% 74.7%",
      "accent-2": "20.1 100% 56.1%",
      "navy": "232.2 31.8% 33.3%"
    },
    "dark": {
      "background": "20 8.6% 6.9%",
      "foreground": "30 35.3% 93.3%",
      "card": "20 11.5% 10.2%",
      "card-foreground": "30 35.3% 93.3%",
      "popover": "20 11.5% 10.2%",
      "popover-foreground": "30 35.3% 93.3%",
      "primary": "20.1 100% 56.1%",
      "primary-foreground": "20 85.7% 5.5%",
      "secondary": "22.5 11.8% 13.3%",
      "secondary-foreground": "30 35.3% 93.3%",
      "muted": "22.5 11.8% 13.3%",
      "muted-foreground": "28.4 11.7% 68%",
      "accent": "20.1 100% 56.1%",
      "accent-foreground": "20 85.7% 5.5%",
      "destructive": "0 100% 71%",
      "destructive-foreground": "0 78.7% 9.2%",
      "border": "20 9.7% 18.2%",
      "input": "20 9.7% 18.2%",
      "ring": "20.1 100% 56.1%",
      "success": "159.3 84.6% 61.8%",
      "success-foreground": "157.5 66.7% 4.7%",
      "warning": "42.1 86.3% 62.7%",
      "warning-foreground": "44 100% 5.9%",
      "info": "232.2 100% 77.5%",
      "info-foreground": "234.4 61.5% 10.2%",
      "agent": "343.1 100% 68%",
      "agent-foreground": "338.9 78.7% 9.2%",
      "chart-1": "20.1 100% 56.1%",
      "chart-2": "159.3 84.6% 61.8%",
      "chart-3": "232.2 100% 77.5%",
      "chart-4": "42.1 86.3% 62.7%",
      "chart-5": "343.1 100% 68%",
      "stage-1": "159.3 84.6% 61.8%",
      "stage-2": "232.2 100% 77.5%",
      "stage-3": "42.1 86.3% 62.7%",
      "stage-4": "28.4 11.7% 68%",
      "stage-5": "159.3 84.6% 61.8%",
      "stage-6": "20.1 100% 56.1%",
      "stage-7": "232.2 100% 77.5%",
      "stage-8": "343.1 100% 68%",
      "stage-9": "159.3 84.6% 61.8%",
      "olive": "86.8 40.7% 64.3%",
      "warn-ink": "42.1 86.3% 62.7%",
      "on-strong": "20 85.7% 5.5%",
      "border-2": "23.1 9.6% 26.5%",
      "accent-2": "20.1 100% 56.1%",
      "navy": "232.2 100% 77.5%"
    }
  },
  "fonts": {
    "sans": "geist",
    "serif": "newsreader",
    "mono": "geist-mono"
  },
  "shape": {
    "radius": 10,
    "glow": 24
  },
  "mascot": {
    "mode": "auto",
    "shell": "bronze",
    "light": "mint"
  },
  "preview": "assets/preview.png"
}
